{
  "report_no": "请填写",
  "class_no": "请填写",
  "secret_level": "请填写",
  "project_source": "国家电网有限公司总部科技项目",
  "title_cn": "请填写中文报告标题",
  "title_en": "Please provide the English report title",
  "project_name": "请填写项目名称",
  "series_no": "",
  "cooperator": [],
  "report_date": "2026年8月",
  "work_period": "",
  "leader": "",
  "staff": "",
  "writer": ""
}
